<?xml version="1.0" encoding="UTF-8"?>
<?xml-stylesheet type="text/xsl" href="books.xslt"?>
<biblioteca xmlns:xsi="http://www.w3.org/2001/XMLSchema-instance" xsi:noNamespaceSchemaLocation="books.xsd">
  <libro>
    <titulo>La vida está en otra parte</titulo>
    <autor>Milan Kundera</autor>
    <fechaPublicacion año="1973"/>
  </libro>
  <libro>
    <titulo>Pantaleón y las visitadoras</titulo>
    <autor fechaNacimiento="28/03/1936">Mario Vargas Llosa</autor>
    <fechaPublicacion año="1973"/>
  </libro>
  <libro>
    <titulo>Conversación en la catedral</titulo>
    <autor fechaNacimiento="28/03/1936">Mario Vargas Llosa</autor>
    <fechaPublicacion año="1969"/>
  </libro>
</biblioteca>

<!-- Crear un XSL que muestre el título y los autores de cada libro, utilizando como template el elemento
“libro”. Tal como se muestra en la siguiente figura. -->